{
  "$schema": "./ph.schema.json",
  "template_version": "1.2.3",
  "adapter_mode": "portable",
  "canonical": {
    "root": ".agents",
    "agents": ".agents/AGENTS.md",
    "manifest": ".agents/ph.json",
    "schema": ".agents/ph.schema.json",
    "memory": ".agents/project-harness/memory",
    "skills": ".agents/skills",
    "scripts": ".agents/scripts"
  },
  "adapters": {
    "root_agents": {
      "mode": "managed_copy",
      "path": "AGENTS.md",
      "source": ".agents/AGENTS.md"
    },
    "claude_entry": {
      "mode": "import_stub",
      "path": "CLAUDE.md",
      "source": ".agents/AGENTS.md"
    },
    "claude_skills": {
      "mode": "mirror_tree",
      "path": ".claude/skills",
      "source": ".agents/skills",
      "include": "ph-*"
    }
  },
  "worktree": {
    "root": ".worktrees",
    "gitignore_entry": "/.worktrees/",
    "path_mode": "slug_hash",
    "wip_prefix": "wip:",
    "verify_commands": [],
    "max_changed_file_bytes": 10485760
  },
  "memory": {
    "root": ".agents/project-harness/memory",
    "directories": {
      "temporary": "temporary",
      "structured": "structured",
      "archive": "../archive/memory"
    },
    "frontmatter_fields": [
      "kind",
      "status",
      "created",
      "updated",
      "provenance",
      "confidence",
      "review_after",
      "supersedes",
      "sensitivity",
      "topics"
    ]
  },
  "skills": {
    "root": ".agents/skills",
    "required_names": [
      "ph-init",
      "ph-merge-update",
      "ph-worktree-enter",
      "ph-worktree-exit",
      "ph-memory-ask",
      "ph-memory-learning",
      "ph-memory-archive",
      "ph-human",
      "ph-require",
      "ph-clarify",
      "ph-design",
      "ph-design-review",
      "ph-tasks",
      "ph-verify-plan",
      "ph-small-change",
      "ph-implement",
      "ph-verify",
      "ph-archive"
    ]
  }
}
